{
  "kind": "solana",
  "network": "mainnet",
  "start_block": 175408000,
  "finalized_blocks_only": false,
  "tables": {
    "block_headers": {
      "schema": {
        "arrow": {
          "fields": [
            {
              "name": "slot",
              "type": "UInt64",
              "nullable": false
            },
            {
              "name": "parent_slot",
              "type": "UInt64",
              "nullable": false
            },
            {
              "name": "block_hash",
              "type": {
                "FixedSizeBinary": 32
              },
              "nullable": false
            },
            {
              "name": "previous_block_hash",
              "type": {
                "FixedSizeBinary": 32
              },
              "nullable": false
            },
            {
              "name": "block_height",
              "type": "UInt64",
              "nullable": true
            },
            {
              "name": "block_time",
              "type": "Int64",
              "nullable": true
            }
          ]
        }
      },
      "network": "mainnet"
    },
    "messages": {
      "schema": {
        "arrow": {
          "fields": [
            {
              "name": "slot",
              "type": "UInt64",
              "nullable": false
            },
            {
              "name": "tx_index",
              "type": "UInt32",
              "nullable": false
            },
            {
              "name": "num_required_signatures",
              "type": "UInt8",
              "nullable": false
            },
            {
              "name": "num_readonly_signed_accounts",
              "type": "UInt8",
              "nullable": false
            },
            {
              "name": "num_readonly_unsigned_accounts",
              "type": "UInt8",
              "nullable": false
            },
            {
              "name": "instructions",
              "type": {
                "List": {
                  "name": "item",
                  "data_type": {
                    "Struct": [
                      {
                        "name": "program_id_index",
                        "data_type": "UInt8",
                        "nullable": false,
                        "dict_id": 0,
                        "dict_is_ordered": false,
                        "metadata": {}
                      },
                      {
                        "name": "accounts",
                        "data_type": {
                          "List": {
                            "name": "item",
                            "data_type": "UInt8",
                            "nullable": true,
                            "dict_id": 0,
                            "dict_is_ordered": false,
                            "metadata": {}
                          }
                        },
                        "nullable": false,
                        "dict_id": 0,
                        "dict_is_ordered": false,
                        "metadata": {}
                      },
                      {
                        "name": "data",
                        "data_type": "Utf8",
                        "nullable": false,
                        "dict_id": 0,
                        "dict_is_ordered": false,
                        "metadata": {}
                      },
                      {
                        "name": "stack_height",
                        "data_type": "UInt32",
                        "nullable": true,
                        "dict_id": 0,
                        "dict_is_ordered": false,
                        "metadata": {}
                      }
                    ]
                  },
                  "nullable": true,
                  "dict_id": 0,
                  "dict_is_ordered": false,
                  "metadata": {}
                }
              },
              "nullable": false
            },
            {
              "name": "account_keys",
              "type": {
                "List": {
                  "name": "item",
                  "data_type": "Utf8",
                  "nullable": true,
                  "dict_id": 0,
                  "dict_is_ordered": false,
                  "metadata": {}
                }
              },
              "nullable": false
            },
            {
              "name": "recent_block_hash",
              "type": {
                "FixedSizeBinary": 32
              },
              "nullable": false
            }
          ]
        }
      },
      "network": "mainnet"
    },
    "transactions": {
      "schema": {
        "arrow": {
          "fields": [
            {
              "name": "tx_index",
              "type": "UInt32",
              "nullable": false
            },
            {
              "name": "tx_signatures",
              "type": {
                "List": {
                  "name": "item",
                  "data_type": "Utf8",
                  "nullable": true,
                  "dict_id": 0,
                  "dict_is_ordered": false,
                  "metadata": {}
                }
              },
              "nullable": false
            },
            {
              "name": "status",
              "type": "Boolean",
              "nullable": true
            },
            {
              "name": "fee",
              "type": "UInt64",
              "nullable": true
            },
            {
              "name": "pre_balances",
              "type": {
                "List": {
                  "name": "item",
                  "data_type": "UInt64",
                  "nullable": true,
                  "dict_id": 0,
                  "dict_is_ordered": false,
                  "metadata": {}
                }
              },
              "nullable": true
            },
            {
              "name": "post_balances",
              "type": {
                "List": {
                  "name": "item",
                  "data_type": "UInt64",
                  "nullable": true,
                  "dict_id": 0,
                  "dict_is_ordered": false,
                  "metadata": {}
                }
              },
              "nullable": true
            },
            {
              "name": "slot",
              "type": "UInt64",
              "nullable": false
            }
          ]
        }
      },
      "network": "mainnet"
    }
  }
}